mysql> SELECT * FROM school
    -> ;
+----+---------------------------------------------+----------+----------------+
| id | name                                        | capacity | country        |
+----+---------------------------------------------+----------+----------------+
|  1 | Hogwarts School of witchcraft and wizadry   |      450 | United Kingdom |
|  5 | Beauxbatons Academy of Magic                |      550 | France         |
|  6 | Castelbruxo                                 |      380 | Brazil         |
|  7 | Dumstrang Institute                         |      570 | Norway         |
|  8 | Ilvermony School of Witchcraft and Wizardry |      300 | USA            |
|  9 | Koldovstoretz                               |      125 | Russia         |
| 10 | Mahoutokoro School of Magic                 |      800 | Japan          |
| 11 | Uagadou School of Magic                     |      350 | Uganda         |
+----+---------------------------------------------+----------+----------------+
8 rows in set (0.00 sec)

mysql> UPDATE school
    -> SET country = 'Sweden'
    -> WHERE id = 7
    -> ;
Query OK, 1 row affected (0.01 sec)
Rows matched: 1  Changed: 1  Warnings: 0

mysql> UPDATE school SET capacity = 700 WHERE id = 7;
Query OK, 1 row affected (0.01 sec)
Rows matched: 1  Changed: 1  Warnings: 0

mysql> DELETE FROM school WHERE name LIKE '%Magic' ;
Query OK, 3 rows affected (0.00 sec)

mysql> SELECT * FROM school
    -> ;
+----+---------------------------------------------+----------+----------------+
| id | name                                        | capacity | country        |
+----+---------------------------------------------+----------+----------------+
|  1 | Hogwarts School of witchcraft and wizadry   |      450 | United Kingdom |
|  6 | Castelbruxo                                 |      380 | Brazil         |
|  7 | Dumstrang Institute                         |      700 | Sweden         |
|  8 | Ilvermony School of Witchcraft and Wizardry |      300 | USA            |
|  9 | Koldovstoretz                               |      125 | Russia         |
+----+---------------------------------------------+----------+----------------+
5 rows in set (0.00 sec)
